pvc_lemmas,file_path,row,is_phrasal,annotator_agreement_percentage,sents,aligned_idxs,verbs_fixed,sent_string,verb_string
"['have', 'on']",J/J9/J94.xml,72,false,1.0,"['mm', 'yes', 'get', 'us', 'at', 'a', 'much', 'more', 'er', 'er', 'effective', 'role', 'in', 'reducing', 'tariffs', 'on', 'manufactured', 'goods', 'than', 'it', 'has', 'on', 'agricultural', 'goods', 'and', 'it', ""'s"", 'only', 'in', 'this', 'last', 'round', 'of', 'G', 'A', 'T', 'T', 'talks', ',', 'the', 'Uruguay', 'round', 'that', 'agriculture', 'has', 'been', 'brought', 'into', 'the', 'frame', 'alright', '.']","[20, 21]","['has', 'on']","mm yes get us at a much more er er effective role in reducing tariffs on manufactured goods than it has on agricultural goods and it 's only in this last round of G A T T talks , the Uruguay round that agriculture has been brought into the frame alright .",has on
"['make', 'out']",G/GV/GVP.xml,2878,true,1.0,"['Can', 'you', 'make', 'out', 'what', 'they', ""'re"", 'rabbiting', 'on', 'about', '?']","[2, 3]","['make', 'out']",Can you make out what they 're rabbiting on about ?,make out
"['get', 'at']",E/EW/EW5.xml,146,true,1.0,"['Discipline', 'yourself', 'to', 'dig', 'deep', 'and', 'get', 'at', 'facts', 'which', 'can', 'be', 'substantiated', '.']","[6, 7]","['get', 'at']",Discipline yourself to dig deep and get at facts which can be substantiated .,get at
"['get', 'by']",F/FB/FBD.xml,710,false,0.8615,"['Otherwise', 'the', 'statement', 'will', 'be', 'false', ';', 'and', 'so', 'therefore', 'will', 'the', 'belief', ',', 'that', 'there', ""'s"", 'honey', ',', 'which', 'Pooh', 'gets', 'by', 'believing', 'what', 'Rabbit', 'says', '.']","[21, 22]","['gets', 'by']","Otherwise the statement will be false ; and so therefore will the belief , that there 's honey , which Pooh gets by believing what Rabbit says .",gets by
"['make', 'out']",C/CC/CCW.xml,1600,true,1.0,"['I', 'twisted', 'around', 'and', 'almost', 'blinded', 'myself', 'by', 'staring', 'straight', 'into', 'the', 'sun', ',', 'but', 'then', ',', 'through', 'the', 'dizzying', 'glare', ',', 'I', 'made', 'out', 'the', 'long', 'silhouette', 'of', 'a', 'tall', 'man', 'who', 'seemed', ',', 'incongruously', ',', 'to', 'be', 'dressed', 'in', 'a', 'long', ',', 'transparent', 'dressing', 'gown', '.']","[23, 24]","['made', 'out']","I twisted around and almost blinded myself by staring straight into the sun , but then , through the dizzying glare , I made out the long silhouette of a tall man who seemed , incongruously , to be dressed in a long , transparent dressing gown .",made out
"['get', 'down', 'to']",A/AB/ABU.xml,1757,true,1.0,"['The', 'consultation', 'period', 'came', 'to', 'an', 'end', 'on', 'September', 'and', 'we', 'then', 'got', 'down', 'to', 'work', 'assessing', 'the', 'reaction', '.']","[12, 13, 14]","['got', 'down', 'to']",The consultation period came to an end on September and we then got down to work assessing the reaction .,got down to
"['get', 'together']",B/BN/BNN.xml,398,true,1.0,"['Behind', 'the', 'tarpaulin', 'there', 'were', 'tables', 'and', 'chairs', 'for', 'the', 'RCM', 'workers', ',', 'mostly', ',', 'as', 'an', 'American', 'journalist', 'noticed', ',', 'elegantly', 'turned-out', 'young', 'ladies', 'who', 'looked', 'a', 'good', 'deal', 'more', 'like', 'a', 'junior', 'league', 'committee', 'getting', 'together', 'to', 'discuss', 'a', 'costume', 'ball', 'than', 'officials', 'waiting', 'to', 'sort', 'out', 'a', 'trainload', 'of', 'Jewish', 'refugee', 'children', '.']","[36, 37]","['getting', 'together']","Behind the tarpaulin there were tables and chairs for the RCM workers , mostly , as an American journalist noticed , elegantly turned-out young ladies who looked a good deal more like a junior league committee getting together to discuss a costume ball than officials waiting to sort out a trainload of Jewish refugee children .",getting together
"['take', 'on']",A/AB/ABC.xml,468,false,0.7187,"['Some', 'solid', 'food', 'will', 'be', 'taken', 'on', 'average', 'from', 'months', 'of', 'age', '.']","[5, 6]","['taken', 'on']",Some solid food will be taken on average from months of age .,taken on
"['take', 'on']",C/CF/CFV.xml,2377,false,1.0,"['You', ""'ll"", 'also', 'be', 'taken', 'on', 'a', 'full', 'day', 'tour', 'of', 'the', 'Dordogne', 'and', 'its', 'best', 'preserved', 'mediaeval', 'treasures', '.']","[4, 5]","['taken', 'on']",You 'll also be taken on a full day tour of the Dordogne and its best preserved mediaeval treasures .,taken on
"['get', 'it', 'on']",E/ED/EDC.xml,1775,false,1.0,"['As', 'I', 'say', ',', 'I', 'only', 'get', 'off', 'the', 'social', 'and', 'when', 'I', 'get', 'it', 'on', 'a', 'Monday', ',', 'I', 'usually', 'spend', 'right', 'away', 'on', 'food', 'for', 'the', 'kids', '.']","[13, 14, 15]","['get', 'it', 'on']","As I say , I only get off the social and when I get it on a Monday , I usually spend right away on food for the kids .",get it on
"['take', 'on']",H/HN/HNW.xml,772,true,1.0,"['Not', 'take', 'on', 'somebody', 'else', ""'s"", '.']","[1, 2]","['take', 'on']",Not take on somebody else 's .,take on
"['make', 'over']",K/K4/K4T.xml,1258,false,1.0,"['No', 'decision', 'has', 'been', 'made', 'over', 'a', 'youth', 'coach', ',', 'a', 'position', 'Hankin', 'held', 'before', 'his', 'sudden', 'promotion', 'to', 'the', 'manager', ""'s"", 'office', '.']","[4, 5]","['made', 'over']","No decision has been made over a youth coach , a position Hankin held before his sudden promotion to the manager 's office .",made over
"['make', 'for']",F/F9/F9H.xml,566,true,0.6437,"['Paned', 'windows', ',', 'instead', 'of', 'the', 'more', 'usual', 'draughty', 'gaps', ',', 'make', 'for', 'warmer', 'viewing', '.']","[11, 12]","['make', 'for']","Paned windows , instead of the more usual draughty gaps , make for warmer viewing .",make for
"['take', 'on']",G/G3/G38.xml,305,true,1.0,"['When', 'MediaStar', 'was', 'formed', 'from', 'the', 'Colman', 'media', 'department', 'at', 'the', 'end', 'of', ',', 'it', 'was', 'the', 'first', 'of', 'the', 'hybrid', 'media', 'departments', 'to', 'take', 'on', 'independent', 'buying', 'work', '.']","[24, 25]","['take', 'on']","When MediaStar was formed from the Colman media department at the end of , it was the first of the hybrid media departments to take on independent buying work .",take on
"['get', 'on']",B/BP/BP0.xml,401,true,0.655,"['They', ""'re"", 'living', 'off', 'beans', 'and', 'cheese', 'and', 'horse', 'and', 'ass-meat', 'if', 'they', 'can', 'pay', 'for', 'it', ',', 'but', 'even', 'the', 'price', 'of', 'dogs', 'and', 'cats', 'is', 'getting', 'on', 'the', 'high', 'side', '.']","[27, 28]","['getting', 'on']","They 're living off beans and cheese and horse and ass-meat if they can pay for it , but even the price of dogs and cats is getting on the high side .",getting on
"['have', 'on']",B/BM/BM0.xml,96,false,0.6767,"['Alexander', 'started', 'to', 'examine', 'the', 'effects', 'that', 'shortening', 'and', 'lengthening', 'of', 'his', 'body', 'had', 'on', 'his', 'voice', '.']","[13, 14]","['had', 'on']",Alexander started to examine the effects that shortening and lengthening of his body had on his voice .,had on
"['get', 'on']",G/GW/GWB.xml,1549,true,0.6853,"['Maurice', 'remained', 'standing', 'in', 'the', 'clearing', 'as', 'though', 'anxious', 'to', 'get', 'on', 'but', 'Wycliffe', 'went', 'along', 'the', 'verandah', 'to', 'the', 'door', '.']","[10, 11]","['get', 'on']",Maurice remained standing in the clearing as though anxious to get on but Wycliffe went along the verandah to the door .,get on
"['get', 'out']",B/B0/B03.xml,1491,false,1.0,"['She', 'constantly', 'felt', 'the', 'need', 'to', 'get', 'out', 'of', 'the', 'house', 'and', 'go', 'somewhere', ',', 'anywhere', 'but', 'always', 'she', 'would', 'return', 'to', 'be', 'punished', ',', 'because', 'there', 'was', 'nowhere', '.']","[6, 7]","['get', 'out']","She constantly felt the need to get out of the house and go somewhere , anywhere but always she would return to be punished , because there was nowhere .",get out
"['get', 'at']",H/H8/H85.xml,2132,true,1.0,"['Someone', 'who', 'could', 'get', 'at', 'the', 'soup', ',', 'too', '.']","[3, 4]","['get', 'at']","Someone who could get at the soup , too .",get at
"['get', 'on', 'with']",C/CK/CK6.xml,2474,true,1.0,"['Twangtwangtwangtwing', ',', 'that', ""'s"", 'what', ',', 'methodically', 'tuning', 'up', 'their', 'guitars', 'until', 'you', 'want', 'to', 'rush', 'the', 'stage', 'and', 'just', 'bloody', 'well', 'get', 'on', 'with', 'the', 'set', 'yourself', '.']","[22, 23, 24]","['get', 'on', 'with']","Twangtwangtwangtwing , that 's what , methodically tuning up their guitars until you want to rush the stage and just bloody well get on with the set yourself .",get on with
"['take', 'on']",C/CH/CHE.xml,679,true,1.0,"['I', 'was', 'so', 'eager', 'to', 'start', 'training', 'an', 'owl', ',', 'I', 'felt', 'I', 'knew', 'what', 'I', 'was', 'taking', 'on', ',', 'and', 'yet', 'the', 'right', 'bird', 'eluded', 'me', '.']","[17, 18]","['taking', 'on']","I was so eager to start training an owl , I felt I knew what I was taking on , and yet the right bird eluded me .",taking on
"['get', 'it', 'on']",K/KC/KC4.xml,2492,false,1.0,"['Do', ""n't"", 'know', 'if', 'you', 'get', 'it', 'on', 'hotel', 'bills', ',', 'I', 'think', 'they', 'have', 'to', 'pay', 'something', ',', 'yes', '.']","[5, 6, 7]","['get', 'it', 'on']","Do n't know if you get it on hotel bills , I think they have to pay something , yes .",get it on
"['take', 'on']",J/JY/JY8.xml,890,true,1.0,"['Already', 'the', 'forest', 'had', 'taken', 'on', 'a', 'menacing', 'gloom', '.']","[4, 5]","['taken', 'on']",Already the forest had taken on a menacing gloom .,taken on
"['get', 'out']",H/HN/HNW.xml,765,false,0.6942,"['Kate', 'was', 'Mary', ""'s"", 'tutor', 'and', 'she', 'encouraged', 'Mary', 'to', 'clarify', 'what', 'she', 'wanted', 'to', 'get', 'out', 'of', 'the', 'videos', 'and', 'work', 'through', 'questions', 'to', 'identify', 'issues', 'which', 'Mary', 'could', 'then', 'pursue', '.']","[15, 16]","['get', 'out']",Kate was Mary 's tutor and she encouraged Mary to clarify what she wanted to get out of the videos and work through questions to identify issues which Mary could then pursue .,get out
"['make', 'for']",H/HX/HXD.xml,796,false,1.0,"['Application', 'is', 'normally', 'made', 'for', 'Part', 'A', 'and', 'Part', 'B', 'registration', 'might', 'be', 'granted', 'if', 'there', 'is', 'some', 'doubt', 'about', 'the', 'mark', '.']","[3, 4]","['made', 'for']",Application is normally made for Part A and Part B registration might be granted if there is some doubt about the mark .,made for
"['take', 'on']",A/AS/ASL.xml,1089,true,1.0,"['In', 'people', 'with', 'sickle', 'cell', 'anaemia', ',', 'the', 'molecule', 'that', 'carries', 'oxygen', 'in', 'the', 'blood', ',', 'haemoglobin', ',', 'is', 'abnormal', ',', 'and', 'the', 'red', 'blood', 'cells', 'take', 'on', 'a', 'sickle', 'shape', '.']","[26, 27]","['take', 'on']","In people with sickle cell anaemia , the molecule that carries oxygen in the blood , haemoglobin , is abnormal , and the red blood cells take on a sickle shape .",take on
"['make', 'out']",C/CE/CEH.xml,66,true,1.0,"['So', 'how', 'are', 'you', 'making', 'out', '?']","[4, 5]","['making', 'out']",So how are you making out ?,making out
"['have', 'on']",H/HG/HGM.xml,1930,false,1.0,"['With', 'a', 'little', 'judicious', 'handling', 'to', 'hide', 'the', 'worst', 'of', 'the', 'bruising', ',', 'I', 'think', 'we', ""'ll"", 'manage', 'to', 'minimise', 'the', 'impact', 'it', 'will', 'have', 'on', 'the', 'Press', '.']","[24, 25]","['have', 'on']","With a little judicious handling to hide the worst of the bruising , I think we 'll manage to minimise the impact it will have on the Press .",have on
"['take', 'on']",G/G1/G1G.xml,1201,false,1.0,"['Thus', 'structuralists', ',', 'as', 'Lukes', 'argued', ',', 'are', 'able', 'to', 'take', 'on', 'board', 'the', 'insights', 'of', 'elite', 'and', 'pluralist', 'theories', 'and', 'explain', 'why', 'it', 'is', 'that', 'despite', 'a', 'pluralist', 'system', 'the', 'capitalist', 'ruling', 'class', 'is', 'still', 'able', 'to', 'dominate', 'society', 'even', 'without', 'the', 'use', 'of', 'direct', 'repression', '.']","[10, 11]","['take', 'on']","Thus structuralists , as Lukes argued , are able to take on board the insights of elite and pluralist theories and explain why it is that despite a pluralist system the capitalist ruling class is still able to dominate society even without the use of direct repression .",take on
"['get', 'on']",K/KD/KD8.xml,3143,true,0.6767,"['And', 'all', 'the', 'traffic', 'got', 'on', 'the', 'side', 'for', 'it', 'to', 'go', '.']","[4, 5]","['got', 'on']",And all the traffic got on the side for it to go .,got on
"['make', 'for']",G/G2/G20.xml,258,false,1.0,"['The', 'charge', 'made', 'for', 'school', 'meals', 'is', 'a', 'good', 'example', ',', 'and', 'in', 'recent', 'years', 'the', 'burden', 'has', 'grown', 'as', 'the', 'price', 'of', 'a', 'school', 'meal', 'has', 'increased', 'dramatically', '.']","[2, 3]","['made', 'for']","The charge made for school meals is a good example , and in recent years the burden has grown as the price of a school meal has increased dramatically .",made for
"['make', 'out']",C/CE/CEJ.xml,2372,false,1.0,"['The', 'criticism', 'was', 'not', 'made', 'out', 'loud', 'but', 'Jesus', 'sensed', 'what', 'Simon', 'was', 'thinking', '.']","[4, 5]","['made', 'out']",The criticism was not made out loud but Jesus sensed what Simon was thinking .,made out
"['get', 'through']",J/JJ/JJR.xml,400,true,0.6767,"['Good', 'grief', 'you', ""'ve"", 'got', 'through', 'your', 'books', 'very', 'quickly', '.']","[4, 5]","['got', 'through']",Good grief you 've got through your books very quickly .,got through
"['get', 'on']",H/HE/HEM.xml,12,false,0.6502,"['And', 'the', 'ambition', 'of', 'all', 'the', 'farm', 'lads', 'then', 'was', 'to', 'get', 'on', 'good', 'terms', 'with', 'the', 'maids', 'in', 'in', 'the', 'Plas', 'because', 'after', 'the', 'gentry', ',', 'they', ""'d"", 'had', 'their', 'dinner', ',', 'the', 'maids', 'could', 'invite', 'whoever', 'they', 'liked', 'into', 'the', 'cellar', 'and', 'saloon', 'for', 'supper', '.']","[11, 12]","['get', 'on']","And the ambition of all the farm lads then was to get on good terms with the maids in in the Plas because after the gentry , they 'd had their dinner , the maids could invite whoever they liked into the cellar and saloon for supper .",get on
"['get', 'together']",K/KG/KGN.xml,742,true,1.0,"['Is', ""n't"", 'exactly', 'what', ""'s"", 'happening', ',', 'I', 'mean', 'what', ',', 'what', ""'s"", 'happening', 'is', 'that', 'if', 'they', 'ri', 'erm', 'increase', 'rents', 'or', 'whatever', ',', 'the', 'people', 'who', ',', 'who', 'ca', ""n't"", 'pay', 'that', 'they', 'get', 'together', 'and', 'they', 'demonstrate']","[35, 36]","['get', 'together']","Is n't exactly what 's happening , I mean what , what 's happening is that if they ri erm increase rents or whatever , the people who , who ca n't pay that they get together and they demonstrate",get together
"['get', 'through']",F/F8/F8B.xml,192,true,0.675,"['which', 'I', 'think', 'there', 'were', 'four', 'competitors', ',', 'one', 'of', 'whom', 'got', 'through', 'to', 'the', 'district', 'final', 'and', 'eventually', 'to', 'the', 'national', 'final', 'that', 'John', 'is', 'going', 'to', 'on', 'Saturday', '.']","[11, 12]","['got', 'through']","which I think there were four competitors , one of whom got through to the district final and eventually to the national final that John is going to on Saturday .",got through
"['get', 'on']",K/KB/KBW.xml,11868,true,0.6905,"['This', 'huge', ',', 'you', 'know', ',', 'one', 'two', 'five', 'came', 'ooh', 'we', 'said', ',', 'do', ""n't"", 'get', 'on', 'there', 'if', 'you', 'want', 'the', 'university', '.']","[16, 17]","['get', 'on']","This huge , you know , one two five came ooh we said , do n't get on there if you want the university .",get on
"['take', 'on']",K/K2/K25.xml,3805,true,1.0,"['In', 'the', 'first', 'division', ',', 'Oxford', 'take', 'on', 'Luton', 'at', 'the', 'Manor', '.']","[6, 7]","['take', 'on']","In the first division , Oxford take on Luton at the Manor .",take on
"['get', 'about']",G/G6/G64.xml,374,true,1.0,"['I', 'mean', 'we', 'could', 'get', 'about', ',', 'we', 'got', 'about', 'alright', '.']","[4, 5]","['get', 'about']","I mean we could get about , we got about alright .",get about
"['take', 'on']",K/K2/K27.xml,1046,true,1.0,"['The', 'last', 'time', 'Gloucester', 'went', 'to', 'Tyneside', 'to', 'play', 'in', 'the', 'cup', 'they', 'took', 'on', 'the', 'old', 'Gosforth', 'team', 'the', 'score', 'that', 'day', 'to', 'the', 'Cherry', 'and', 'whites', 'that', 'was', 'almost', 'three', 'years', 'ago']","[13, 14]","['took', 'on']",The last time Gloucester went to Tyneside to play in the cup they took on the old Gosforth team the score that day to the Cherry and whites that was almost three years ago,took on
"['get', 'out']",G/G5/G59.xml,723,true,0.6649,"['So', 'it', ""'s"", 'just', 'a', 'matter', ',', 'as', 'soon', 'as', 'we', 'come', 'back', ',', 'get', 'out', '.']","[14, 15]","['get', 'out']","So it 's just a matter , as soon as we come back , get out .",get out
"['get', 'on']",A/A0/A0R.xml,2245,false,0.6509,"['If', 'you', 'like', 'to', 'get', 'on', 'I', ""'ll"", 'fetch', 'my', 'horse', '.']","[4, 5]","['get', 'on']",If you like to get on I 'll fetch my horse .,get on
"['get', 'at']",K/K9/K97.xml,12492,true,1.0,"['I', 'watched', 'the', 'video', 'of', 'Romania', 'losing', 'there', 'and', 'the', 'Romanians', 'had', 'chances', ',', 'so', 'we', 'know', 'the', 'Belgians', 'can', 'be', 'got', 'at', '.']","[21, 22]","['got', 'at']","I watched the video of Romania losing there and the Romanians had chances , so we know the Belgians can be got at .",got at
"['get', 'behind']",J/J1/J1E.xml,822,true,0.6927,"['Whether', 'this', 'was', 'due', 'to', 'Wilko', ""'s"", 'tactics', 'I', 'do', 'nt', 'know', ',', 'but', 'noone', 'ever', 'looked', 'to', 'get', 'behind', 'their', 'defence', 'noone', 'was', 'making', 'darting', 'runs', 'across', 'and', 'behind', '.']","[18, 19]","['get', 'behind']","Whether this was due to Wilko 's tactics I do nt know , but noone ever looked to get behind their defence noone was making darting runs across and behind .",get behind
"['get', 'out']",H/HT/HTG.xml,3859,false,0.6773,"['The', 'blunt', 'instrument', 'obstinately', 'refused', 'to', 'reveal', 'itself', 'and', 'he', 'doubted', 'if', 'there', 'were', 'any', 'more', 'revelations', 'to', 'be', 'got', 'out', 'of', 'anybody', '.']","[19, 20]","['got', 'out']",The blunt instrument obstinately refused to reveal itself and he doubted if there were any more revelations to be got out of anybody .,got out
"['give', 'in']",H/HG/HGK.xml,1265,true,1.0,"['He', 'shot', 'a', 'very', 'cross', 'look', 'at', 'Maggie', 'but', 'gave', 'in', 'almost', 'at', 'once', '.']","[9, 10]","['gave', 'in']",He shot a very cross look at Maggie but gave in almost at once .,gave in
"['get', 'together']",B/B0/B0H.xml,1704,true,1.0,"['If', 'one', 'prescient', 'soul', 'at', 'your', 'level', ',', 'say', ',', 'early', 'in', ',', 'really', 'had', 'thought', 'ministers', 'should', 'be', 'forced', 'to', 'meet', 'on', 'this', 'issue', 'and', 'they', 'kept', 'postponing', 'discussions', 'on', 'the', 'Falklands', ',', 'could', 'you', 'as', 'Permanent', 'Secretary', 'of', 'Defence', 'have', 'ensured', 'that', 'relevant', 'Cabinet', 'ministers', 'did', 'get', 'together', 'and', 'look', 'at', 'the', 'problem', 'rationally', 'and', 'seriously', ',', 'in', 'so', 'far', 'as', 'it', ""'s"", 'possible', ',', 'in', 'time', '?']","[48, 49]","['get', 'together']","If one prescient soul at your level , say , early in , really had thought ministers should be forced to meet on this issue and they kept postponing discussions on the Falklands , could you as Permanent Secretary of Defence have ensured that relevant Cabinet ministers did get together and look at the problem rationally and seriously , in so far as it 's possible , in time ?",get together
"['get', 'on', 'with']",G/GV/GV7.xml,900,true,1.0,"['Then', 'he', 'could', 'go', 'out', 'and', 'enjoy', 'himself', 'unashamedly', 'and', 'leave', 'serious', ',', 'studious', 'Doctor', 'Jekyll', 'to', 'get', 'on', 'with', 'his', 'important', ',', 'life-saving', 'work', '.']","[17, 18, 19]","['get', 'on', 'with']","Then he could go out and enjoy himself unashamedly and leave serious , studious Doctor Jekyll to get on with his important , life-saving work .",get on with
"['get', 'off']",K/KN/KNC.xml,584,false,0.6827,"['Now', 'we', 'got', 'off', 'the', 'phone', 'and', 'knowing', 'the', 'man', 'I', 'allowed', 'three', '.']","[2, 3]","['got', 'off']",Now we got off the phone and knowing the man I allowed three .,got off
"['give', 'in']",C/CF/CFR.xml,1265,false,1.0,"['If', 'on', 'your', 'first', 'day', 'of', 'testing', 'you', 'see', 'a', 'colour', 'which', 'is', 'the', 'same', 'or', 'darker', 'than', 'the', 'reference', 'colour', 'given', 'in', 'the', 'test', ',', 'you', 'should', 'go', 'ahead', 'and', 'have', 'intercourse', '.']","[21, 22]","['given', 'in']","If on your first day of testing you see a colour which is the same or darker than the reference colour given in the test , you should go ahead and have intercourse .",given in
"['get', 'out']",A/AL/ALH.xml,2742,false,0.598,"['I', 'want', 'to', 'get', 'out', 'of', 'here', '.']","[3, 4]","['get', 'out']",I want to get out of here .,get out
"['get', 'down', 'to']",G/G1/G1A.xml,661,true,0.6773,"['Just', 'for', 'a', 'couple', 'of', 'nights', 'in', 'Dieppe', ':', 'though', 'I', 'sometimes', 'take', 'the', 'car', 'and', 'get', 'down', 'to', 'Rouen', '.']","[16, 17, 18]","['get', 'down', 'to']",Just for a couple of nights in Dieppe : though I sometimes take the car and get down to Rouen .,get down to
"['get', 'on']",C/CG/CGH.xml,166,true,1.0,"['I', 'am', 'confident', 'that', 'these', 'different-looking', 'species', 'of', 'Synodontis', 'will', 'get', 'on', 'together', ',', 'whereas', 'two', 'of', 'the', 'same', 'or', 'similar', 'species', 'may', 'not', '.']","[10, 11]","['get', 'on']","I am confident that these different-looking species of Synodontis will get on together , whereas two of the same or similar species may not .",get on
"['get', 'through']",J/J1/J1J.xml,174,true,1.0,"['Are', 'messages', 'getting', 'through', 'ok', '?']","[2, 3]","['getting', 'through']",Are messages getting through ok ?,getting through
"['have', 'on']",B/B2/B20.xml,1509,true,0.6781,"['She', 'still', 'had', 'on', 'the', 'revealing', 'silk', 'blouse', 'she', 'had', 'worn', 'in', 'the', 'show', ',', 'with', 'stage', 'jewellery', 'sparkling', 'at', 'her', 'throat', 'and', 'breast', '.']","[2, 3]","['had', 'on']","She still had on the revealing silk blouse she had worn in the show , with stage jewellery sparkling at her throat and breast .",had on
"['get', 'on', 'with']",B/B3/B3H.xml,776,true,1.0,"['Whatever', 'their', 'opinion', 'of', 'him', 'he', 'was', 'clearly', 'in', 'touch', 'with', 'other', 'artists', ',', 'as', 'in', 'April', 'he', 'complains', 'bitterly', 'of', 'not', 'being', 'able', 'to', 'get', 'on', 'with', 'his', 'painting', 'because', 'of', 'other', 'artists', 'coming', 'to', 'see', 'his', 'work', '.']","[25, 26, 27]","['get', 'on', 'with']","Whatever their opinion of him he was clearly in touch with other artists , as in April he complains bitterly of not being able to get on with his painting because of other artists coming to see his work .",get on with
"['get', 'on']",H/HG/HGT.xml,3631,true,0.6786,"['We', 'just', 'do', ""n't"", 'get', 'on', ',', 'Robyn', 'declared', 'neutrally', '.']","[4, 5]","['get', 'on']","We just do n't get on , Robyn declared neutrally .",get on
"['take', 'on']",A/AR/ARG.xml,1334,true,1.0,"['He', 'comes', 'alongside', 'us', 'and', 'takes', 'on', 'our', 'humanity', ',', 'in', 'order', 'for', 'us', 'to', 'see', 'him', ',', 'in', 'the', 'same', 'way', 'that', 'the', 'intensity', 'of', 'the', 'sun', 'is', 'scaled', 'down', 'to', 'the', 'ray', 'of', 'light', 'through', 'the', 'window', '.']","[5, 6]","['takes', 'on']","He comes alongside us and takes on our humanity , in order for us to see him , in the same way that the intensity of the sun is scaled down to the ray of light through the window .",takes on
"['get', 'out']",C/CS/CS4.xml,591,false,1.0,"['It', 'obviously', 'was', ""n't"", 'just', 'a', 'quarrel', 'which', 'got', 'out', 'of', 'hand', ',', 'or', 'robbery', 'with', 'violence', '.']","[8, 9]","['got', 'out']","It obviously was n't just a quarrel which got out of hand , or robbery with violence .",got out
"['get', 'through']",A/AB/ABV.xml,1415,true,0.6905,"['Her', 'great', 'ability', 'was', 'to', 'get', 'through', 'to', 'the', 'outcasts', 'of', 'society', 'the', 'drunks', ',', 'the', 'crazed', ',', 'the', 'depressed', '.']","[5, 6]","['get', 'through']","Her great ability was to get through to the outcasts of society the drunks , the crazed , the depressed .",get through
"['get', 'out']",H/HT/HTS.xml,985,true,1.0,"['The', 'girls', 'got', 'out', 'alive', ',', 'and', 'were', 'in', 'their', 'beds', 'not', 'long', 'after', 'midnight', ',', 'little', 'Cinderellas', '.']","[2, 3]","['got', 'out']","The girls got out alive , and were in their beds not long after midnight , little Cinderellas .",got out
"['make', 'for']",H/HX/HX0.xml,609,true,1.0,"['We', 'believe', 'that', 'this', 'aspect', 'of', 'general', 'SVQs', 'makes', 'for', 'a', 'better', 'programme', ',', 'because', 'it', 'emphasises', 'the', 'vocational', 'relevance', 'of', 'skills', 'like', 'numeracy', 'and', 'information', 'technology', '.']","[8, 9]","['makes', 'for']","We believe that this aspect of general SVQs makes for a better programme , because it emphasises the vocational relevance of skills like numeracy and information technology .",makes for
