pvc_lemmas,file_path,row,is_phrasal,annotator_agreement_percentage,sents,aligned_idxs,verbs_fixed,sent_string,verb_string
"['get', 'at']",H/HA/HAE.xml,868,false,1.0,"['In', 'his', 'mind', ',', 'Roxburgh', 'must', 'have', 'reckoned', 'on', 'getting', 'at', 'least', 'a', 'point', 'in', 'Berne', '.']","[9, 10]","['getting', 'at']","In his mind , Roxburgh must have reckoned on getting at least a point in Berne .",getting at
"['get', 'on']",J/JN/JNX.xml,891,true,1.0,"['Because', 'what', 'you', 'n', 'notice', 'is', 'there', ""'s"", 'about', 'sort', 'of', 'erm', 'getting', 'on', 'towards', 'half', 'an', 'inch', 'overlap', 'between', 'the', 'louvres', '.']","[12, 13]","['getting', 'on']",Because what you n notice is there 's about sort of erm getting on towards half an inch overlap between the louvres .,getting on
"['make', 'out']",H/HA/HA3.xml,3148,true,1.0,"['Then', 'he', 'made', 'out', 'the', 'thousands', 'of', 'tiny', 'rings', 'that', 'studded', 'the', 'ceiling', '.']","[2, 3]","['made', 'out']",Then he made out the thousands of tiny rings that studded the ceiling .,made out
"['get', 'on']",H/HR/HR9.xml,1076,true,1.0,"['Maybe', ',', 'I', 'said', ',', 'with', 'a', 'completely', 'straight', 'face', ',', 'he', 'wants', 'to', 'see', 'how', 'the', 'units', 'are', 'getting', 'on', '.']","[19, 20]","['getting', 'on']","Maybe , I said , with a completely straight face , he wants to see how the units are getting on .",getting on
"['have', 'on']",J/JY/JY2.xml,3080,false,1.0,"['Trying', 'to', 'ignore', 'the', 'disturbing', 'effect', 'he', 'had', 'on', 'her', 'heart-rate', ',', 'she', 'said', 'crisply', ',', 'Well', ',', 'if', 'it', ""'s"", 'a', 'fight', 'you', ""'re"", 'hoping', 'for']","[7, 8]","['had', 'on']","Trying to ignore the disturbing effect he had on her heart-rate , she said crisply , Well , if it 's a fight you 're hoping for",had on
"['take', 'on']",E/EC/ECK.xml,306,true,0.6767,"['His', 'original', 'partner', 'had', 'been', 'killed', 'in', 'a', 'shoot-out', 'four', 'years', 'earlier', 'but', 'instead', 'of', 'taking', 'on', 'a', 'new', 'partner', 'Mauer', 'now', 'worked', 'with', 'the', 'rookies', ',', 'showing', 'them', 'the', 'ropes', 'and', 'generally', 'helping', 'them', 'to', 'settle', 'into', 'the', 'daily', 'routine', 'at', 'the', 'Mozartstrasse', 'precinct', 'as', 'quickly', 'as', 'possible', 'after', 'their', 'graduation', 'from', 'the', 'Police', 'Academy', 'in', 'Vienna', '.']","[15, 16]","['taking', 'on']","His original partner had been killed in a shoot-out four years earlier but instead of taking on a new partner Mauer now worked with the rookies , showing them the ropes and generally helping them to settle into the daily routine at the Mozartstrasse precinct as quickly as possible after their graduation from the Police Academy in Vienna .",taking on
"['take', 'on']",C/CF/CFY.xml,654,true,1.0,"['I', 'took', 'on', 'where', 'he', 'left', 'off', 'what', 'have', 'you', 'done', 'for', 'me', '?']","[1, 2]","['took', 'on']",I took on where he left off what have you done for me ?,took on
"['take', 'on']",E/EF/EFG.xml,1758,true,1.0,"['But', 'there', 'have', 'been', 'people', 'so', 'sunk', 'in', 'self-blame', 'they', ""'ve"", 'taken', 'on', 'the', 'guilt', 'of', 'their', 'firm', ""'s"", 'collapse', 'which', 'really', 'does', 'have', 'to', 'be', 'nonsense', '.']","[11, 12]","['taken', 'on']",But there have been people so sunk in self-blame they 've taken on the guilt of their firm 's collapse which really does have to be nonsense .,taken on
"['give', 'in']",H/HN/HNW.xml,1577,false,1.0,"['Details', 'of', 'the', 'secondary', 'booklet', 'and', 'of', 'how', 'it', 'is', 'intended', 'to', 'be', 'used', 'are', 'given', 'in', 'Chapter', ',', 'which', 'presents', 'case', 'studies', 'of', 'two', 'secondary', 'schools', 'making', 'use', 'of', 'it', '.']","[15, 16]","['given', 'in']","Details of the secondary booklet and of how it is intended to be used are given in Chapter , which presents case studies of two secondary schools making use of it .",given in
"['give', 'in']",F/FC/FCB.xml,130,false,0.7245,"['As', 'appears', 'from', 'the', 'chronology', 'which', 'I', 'have', 'already', 'recited', 'the', 'purpose', 'of', 'the', 'December', 'charge', 'being', 'executed', 'in', 'favour', 'of', 'the', 'mortgagees', 'was', 'simply', 'to', 'replace', 'the', 'defective', 'charge', 'that', 'had', 'been', 'given', 'in', 'September', '.']","[33, 34]","['given', 'in']",As appears from the chronology which I have already recited the purpose of the December charge being executed in favour of the mortgagees was simply to replace the defective charge that had been given in September .,given in
"['give', 'in']",J/J0/J0V.xml,1608,false,1.0,"['Full', 'details', 'of', 'this', 'process', 'are', 'given', 'in', 'chapters', 'ST', ',', 'MD', 'and', 'CF', 'of', 'the', 'Guidelines', ':', 'the', 'following', 'informal', 'description', 'simply', 'gives', 'an', 'overview', 'of', 'the', 'process', '.']","[6, 7]","['given', 'in']","Full details of this process are given in chapters ST , MD and CF of the Guidelines : the following informal description simply gives an overview of the process .",given in
"['get', 'off']",F/FM/FMR.xml,660,false,0.6437,"['You', ""'re"", 'getting', 'off', 'hydrogen', '.']","[2, 3]","['getting', 'off']",You 're getting off hydrogen .,getting off
"['take', 'on']",C/CR/CRB.xml,2311,true,1.0,"['When', 'their', 'businesses', 'were', 'booming', ',', 'they', 'could', 'afford', 'to', 'pose', 'as', 'tough-talking', 'entrepreneurs', 'keen', 'to', 'take', 'on', 'the', 'telephone', 'companies', '.']","[16, 17]","['take', 'on']","When their businesses were booming , they could afford to pose as tough-talking entrepreneurs keen to take on the telephone companies .",take on
"['get', 'out']",C/CA/CAD.xml,42,true,0.6866,"['They', 'ca', ""n't"", 'now', 'be', 'heard', 'to', 'say', ',', 'Boo', 'hoo', 'I', 'want', 'to', 'get', 'out', 'of', 'it', 'now', ',', 'said', 'Mr', 'Prescott', '.']","[14, 15]","['get', 'out']","They ca n't now be heard to say , Boo hoo I want to get out of it now , said Mr Prescott .",get out
"['have', 'on']",H/H8/H88.xml,86,false,1.0,"['They', 'are', 'rarely', 'challenged', ',', 'nor', 'are', 'the', 'implications', 'of', 'such', 'statements', 'examined', ',', 'despite', 'the', 'effects', 'they', 'are', 'likely', 'to', 'have', 'on', 'educational', 'success', '.']","[21, 22]","['have', 'on']","They are rarely challenged , nor are the implications of such statements examined , despite the effects they are likely to have on educational success .",have on
"['give', 'in']",H/HT/HTE.xml,132,false,1.0,"['However', ',', 'there', 'are', 'exceptions', 'to', 'this', 'general', 'statement', ',', 'and', 'proper', 'descriptions', 'are', 'given', 'in', 'the', 'faculty', 'sections', '.']","[14, 15]","['given', 'in']","However , there are exceptions to this general statement , and proper descriptions are given in the faculty sections .",given in
"['take', 'on']",F/FS/FSN.xml,555,true,1.0,"['My', 'new', 'mother-in-law', ',', 'Martha', ',', 'has', 'worked', 'long', 'and', 'hard', 'for', 'many', 'months', 'to', 'prepare', 'this', 'wonderful', 'occasion', ',', 'all', 'the', 'little', 'details', 'such', 'as', 'these', 'beautiful', 'decorations', 'were', 'planned', 'by', 'her', ',', 'and', 'my', 'father-in-law', 'has', 'taken', 'on', 'his', 'second', 'mortgage', 'without', 'complaint', ',', 'like', 'the', 'good-natured', 'man', 'he', 'is', '.']","[38, 39]","['taken', 'on']","My new mother-in-law , Martha , has worked long and hard for many months to prepare this wonderful occasion , all the little details such as these beautiful decorations were planned by her , and my father-in-law has taken on his second mortgage without complaint , like the good-natured man he is .",taken on
"['get', 'over']",K/KP/KPP.xml,437,true,1.0,"['One', 'of', 'these', 'days', 'you', ""'ll"", 'get', 'over', 'Suzanne', '.']","[6, 7]","['get', 'over']",One of these days you 'll get over Suzanne .,get over
"['get', 'through']",K/KN/KND.xml,793,true,1.0,"['Dow', 'down', 'there', ',', 'and', 'turn', 'around', 'so', 'you', 'can', 'get', 'through', 'and', 'get', 'the', 'curve', '.']","[10, 11]","['get', 'through']","Dow down there , and turn around so you can get through and get the curve .",get through
"['give', 'in']",F/FS/FS0.xml,722,true,0.6534,"['She', ""'s"", 'saying', 'it', ""'s"", 'important', 'to', 'stand', 'firm', ',', 'not', 'give', 'in', 'to', 'terrorists', ',', 'and', 'the', 'rest', ',', 'but', 'she', ""'s"", 'said', ',', 'That', 'does', 'not', 'mean', 'that', 'you', 'do', ""n't"", 'negotiate']","[11, 12]","['give', 'in']","She 's saying it 's important to stand firm , not give in to terrorists , and the rest , but she 's said , That does not mean that you do n't negotiate",give in
"['give', 'in']",E/EF/EFX.xml,330,false,1.0,"['In', 'a', 'broadcast', 'talk', 'which', 'he', 'gave', 'in', 'the', 'spring', 'of', ',', '""', 'Towards', 'a', 'Christian', 'Britain', '""', ',', 'he', 'talked', 'about', 'the', 'sacrifices', 'which', 'would', 'be', 'necessary', 'to', 'bring', 'about', 'such', 'a', 'national', 'conversion', ',', 'and', 'the', 'need', 'for', 'Christian', '""', 'prophets', '""', 'who', 'would', 'alter', 'the', 'social', 'consciousness', 'of', 'the', 'people', '.']","[6, 7]","['gave', 'in']","In a broadcast talk which he gave in the spring of , "" Towards a Christian Britain "" , he talked about the sacrifices which would be necessary to bring about such a national conversion , and the need for Christian "" prophets "" who would alter the social consciousness of the people .",gave in
"['get', 'over']",C/CH/CH1.xml,2442,true,1.0,"['She', 'was', 'trying', 'to', 'get', 'over', 'the', 'death', 'of', 'her', 'husband', ',', 'Michael', 'Whitney', ',', 'from', 'a', 'heart', 'attack', '.']","[4, 5]","['get', 'over']","She was trying to get over the death of her husband , Michael Whitney , from a heart attack .",get over
"['take', 'on']",F/FP/FPK.xml,2093,true,0.6767,"['I', ""'m"", 'worried', 'that', 'you', ""'re"", 'taking', 'on', 'too', 'much', '.']","[6, 7]","['taking', 'on']",I 'm worried that you 're taking on too much .,taking on
"['have', 'on']",C/CR/CR9.xml,2542,false,1.0,"['German', 'companies', 'have', 'on', 'occasion', 'preferred', 'to', 'give', 'business', 'to', 'the', 'big', 'universal', 'banks', 'that', 'are', 'their', 'biggest', 'shareholders', 'than', 'to', 'more', 'competitive', 'foreign', 'firms', '.']","[2, 3]","['have', 'on']",German companies have on occasion preferred to give business to the big universal banks that are their biggest shareholders than to more competitive foreign firms .,have on
"['do', 'up']",K/KB/KB3.xml,257,false,0.688,"['What', ',', 'what', 'are', 'you', 'doing', 'up', '?']","[5, 6]","['doing', 'up']","What , what are you doing up ?",doing up
"['get', 'through']",C/CK/CKF.xml,1078,true,1.0,"['I', ""'ll"", 'ring', 'off', 'now', 'in', 'case', 'he', ""'s"", 'trying', 'to', 'get', 'through', 'to', 'you', '.']","[11, 12]","['get', 'through']",I 'll ring off now in case he 's trying to get through to you .,get through
"['have', 'on']",H/HL/HL1.xml,958,false,0.6767,"['The', 'chairman', 'of', 'the', 'SLORC', ',', 'Saw', 'Maung', ',', 'had', 'on', 'Oct.', 'given', 'the', 'monks', 'a', 'three-day', 'ultimatum', 'to', 'end', 'their', 'protest', 'or', 'face', '""', 'serious', 'consequences', '""', '.']","[9, 10]","['had', 'on']","The chairman of the SLORC , Saw Maung , had on Oct. given the monks a three-day ultimatum to end their protest or face "" serious consequences "" .",had on
"['give', 'in']",J/J2/J2B.xml,109,false,0.8847,"['given', 'in', 'this', 'way', 'enables', 'the', 'College', 'to', 'claim', 'an', 'extra', ',', 'while', 'the', 'higher', 'rate', 'taxpayer', 'obtains', 'tax', 'relief', 'worth', '.']","[0, 1]","['given', 'in']","given in this way enables the College to claim an extra , while the higher rate taxpayer obtains tax relief worth .",given in
"['take', 'on']",G/G1/G1C.xml,668,true,1.0,"['If', 'rebates', 'are', 'extensive', 'this', 'takes', 'on', 'some', 'aspects', 'of', 'an', 'income', 'tax', 'too', '.']","[5, 6]","['takes', 'on']",If rebates are extensive this takes on some aspects of an income tax too .,takes on
"['get', 'through']",B/BN/BNN.xml,1374,true,1.0,"['How', 'Bunce', 'Court', 'got', 'through', 'the', 'war', 'it', 'is', 'hard', 'to', 'imagine', ',', 'but', 'get', 'through', 'it', 'did', 'and', 'with', 'flying', 'colours', ',', 'if', 'the', 'testimony', 'of', 'former', 'pupils', 'is', 'anything', 'to', 'go', 'by', '.']","[3, 4]","['got', 'through']","How Bunce Court got through the war it is hard to imagine , but get through it did and with flying colours , if the testimony of former pupils is anything to go by .",got through
"['get', 'about']",K/KP/KP6.xml,2687,false,1.0,"['We', 'sat', 'in', 'the', 'garden', 'today', 'Luce', 'and', 'we', 'got', 'like', ',', 'me', 'Lucy', 'and', 'Tom', 'and', 'got', 'about', 'three', 'pounds', 'off', 'all', 'the', 'little', 'removes', 'that', 'came', 'in']","[17, 18]","['got', 'about']","We sat in the garden today Luce and we got like , me Lucy and Tom and got about three pounds off all the little removes that came in",got about
"['do', 'up']",K/KD/KDR.xml,1728,false,1.0,"['I', 'think', 'I', 'think', 'it', 'gets', 'dark', 'earlier', 'than', 'it', 'does', 'up', 'here', 'for', 'example']","[10, 11]","['does', 'up']",I think I think it gets dark earlier than it does up here for example,does up
"['make', 'for']",B/BN/BNN.xml,1011,true,1.0,"['Conditions', 'were', 'no', 'better', ',', 'and', 'possibly', 'worse', ',', 'on', 'the', 'Ettrick', 'which', 'made', 'for', 'Canada', 'with', 'RCM', 'boys', 'on', 'board', '.']","[13, 14]","['made', 'for']","Conditions were no better , and possibly worse , on the Ettrick which made for Canada with RCM boys on board .",made for
"['have', 'on']",C/CR/CR6.xml,2265,false,0.6534,"['Like', 'the', 'one', 'she', ""'d"", 'had', 'on', 'her', 'leg', 'a', 'few', 'weeks', 'previously', '.']","[5, 6]","['had', 'on']",Like the one she 'd had on her leg a few weeks previously .,had on
"['get', 'on', 'with']",H/H8/H8F.xml,29,true,0.6679,"['In', 'the', 'meantime', ',', 'though', ',', 'she', 'had', 'to', 'get', 'on', 'with', 'some', 'work', '.']","[9, 10, 11]","['get', 'on', 'with']","In the meantime , though , she had to get on with some work .",get on with
"['get', 'by']",K/K5/K5D.xml,5363,true,1.0,"['Sailor', 'gets', 'by', 'on', 'pedal', 'power']","[1, 2]","['gets', 'by']",Sailor gets by on pedal power,gets by
"['make', 'for']",B/BL/BLY.xml,1014,false,0.6814,"['Little', 'concession', 'either', ',', 'is', 'made', 'for', 'double', 'shift', 'or', 'short', 'session', 'pupils', '.']","[5, 6]","['made', 'for']","Little concession either , is made for double shift or short session pupils .",made for
"['take', 'on']",A/AB/AB3.xml,1681,true,1.0,"['I', 'always', 'will', 'be', ',', 'claiming', 'that', 'taking', 'on', 'the', 'pop', 'funk', 'sound', 'of', 'the', 'moment', 'was', 'a', 'perfect', 'fulfilment', 'of', 'punk', ""'s"", 'evangelist', 'logic', '.']","[7, 8]","['taking', 'on']","I always will be , claiming that taking on the pop funk sound of the moment was a perfect fulfilment of punk 's evangelist logic .",taking on
"['get', 'out']",A/AB/ABX.xml,1239,false,0.6537,"['Philip', 'was', 'thankful', 'to', 'get', 'out', 'of', 'the', 'crowded', 'waiting-room', '.']","[4, 5]","['get', 'out']",Philip was thankful to get out of the crowded waiting-room .,get out
"['have', 'on']",H/HL/HLH.xml,1182,false,1.0,"['Indonesia', ',', 'which', 'had', 'on', 'Feb.', 'declared', 'its', 'territorial', 'waters', 'closed', 'to', 'the', 'ship', 'see', 'pp.', ',', 'had', 'deployed', 'a', 'number', 'of', 'warships', 'to', 'prevent', 'the', 'boat', 'entering', 'its', 'waters', '.']","[3, 4]","['had', 'on']","Indonesia , which had on Feb. declared its territorial waters closed to the ship see pp. , had deployed a number of warships to prevent the boat entering its waters .",had on
"['get', 'off']",C/C8/C8E.xml,1124,true,0.6996,"['Practically', 'the', 'first', 'thing', 'I', 'saw', 'when', 'I', 'got', 'off', 'the', 'train', 'and', 'walked', 'along', 'those', 'roads', 'again', 'was', 'Hairy', 'Back', 'and', 'his', 'dog', ',', 'the', 'Great', 'Dane', '.']","[8, 9]","['got', 'off']","Practically the first thing I saw when I got off the train and walked along those roads again was Hairy Back and his dog , the Great Dane .",got off
"['make', 'for']",B/BN/BN3.xml,320,true,1.0,"['We', 'made', 'for', 'the', 'top', 'front', 'of', 'the', 'vehicle', ',', 'as', 'this', 'provided', 'the', 'best', 'all-round', 'view', '.']","[1, 2]","['made', 'for']","We made for the top front of the vehicle , as this provided the best all-round view .",made for
"['take', 'on']",J/J3/J39.xml,463,true,0.6534,"['It', 'is', 'estimated', 'that', 'around', 'two-fifths', 'of', 'the', 'settlement', 'will', 'be', 'needed', 'to', 'pay', 'off', 'the', 'syndicate', ""'s"", 'American', 'lawyers', 'who', 'had', 'taken', 'on', 'the', 'case', 'on', 'a', '""', 'no', 'win', ',', 'no', 'pay', '""', 'basis', '.']","[22, 23]","['taken', 'on']","It is estimated that around two-fifths of the settlement will be needed to pay off the syndicate 's American lawyers who had taken on the case on a "" no win , no pay "" basis .",taken on
"['get', 'out']",H/HT/HTU.xml,1888,false,0.65,"['Then', ""let's"", 'get', 'out', 'of', 'here', '.']","[2, 3]","['get', 'out']",Then let's get out of here .,get out
"['get', 'on']",C/CE/CEU.xml,2287,false,0.6437,"['Well', 'have', 'you', 'any', 'suggestions', 'about', 'how', 'we', 'get', 'on', 'the', 'machine', '?']","[8, 9]","['get', 'on']",Well have you any suggestions about how we get on the machine ?,get on
"['get', 'on']",G/G0/G0R.xml,1528,true,0.6767,"['They', 'just', 'get', 'on', 'practising', 'their', 'trade', '.']","[2, 3]","['get', 'on']",They just get on practising their trade .,get on
"['get', 'out']",J/JX/JXS.xml,4041,true,0.6534,"['As', 'you', 'yourself', 'so', 'candidly', 'pointed', 'out', ',', 'she', 'was', 'only', 'marrying', 'me', 'for', 'my', 'money', 'and', ',', 'of', 'course', ',', 'to', 'get', 'out', 'of', 'a', 'fix', '.']","[22, 23]","['get', 'out']","As you yourself so candidly pointed out , she was only marrying me for my money and , of course , to get out of a fix .",get out
"['get', 'on']",J/J3/J3T.xml,1,true,0.6644,"['I', 'have', ""n't"", 'managed', 'to', 'escape', 'there', ',', 'I', ""'m"", 'glad', 'just', 'to', 'get', 'on', 'the', 'pitch', '.']","[13, 14]","['get', 'on']","I have n't managed to escape there , I 'm glad just to get on the pitch .",get on
"['get', 'out']",H/HR/HR7.xml,511,true,0.6435,"['A', 'policeman', 'got', 'out', 'of', 'the', 'Porsche', ',', 'putting', 'on', 'his', 'peaked', 'cap', 'as', 'he', 'did', 'so', '.']","[2, 3]","['got', 'out']","A policeman got out of the Porsche , putting on his peaked cap as he did so .",got out
"['have', 'on']",H/HH/HHX.xml,20133,true,0.6292,"['I', 'have', 'said', 'a', 'good', 'deal', 'more', 'on', 'Government', 'Back', 'Benches', 'than', 'I', 'have', 'on', 'Opposition', 'Back', 'Benches', 'and', 'very', 'often', 'it', 'has', 'been', 'what', 'has', 'been', 'done', 'on', 'Government', 'Back', 'Benches', 'that', 'has', 'saved', 'even', 'Labour', 'Governments', 'from', 'some', 'of', 'their', 'follies', '.']","[13, 14]","['have', 'on']",I have said a good deal more on Government Back Benches than I have on Opposition Back Benches and very often it has been what has been done on Government Back Benches that has saved even Labour Governments from some of their follies .,have on
"['get', 'through']",H/HL/HLH.xml,134,true,1.0,"['Its', 'brief', ',', 'according', 'to', 'a', 'resolution', 'unanimously', 'agreed', 'at', 'the', 'UN', 'Security', 'Council', 'on', 'March', ',', 'was', 'to', 'look', 'at', 'the', 'requirements', 'for', 'a', 'future', 'peacekeeping', 'operation', 'and', 'to', 'create', '""', 'mechanisms', 'to', 'ensure', 'humanitarian', 'aid', 'can', 'get', 'through', 'unhindered', '""', '.']","[38, 39]","['get', 'through']","Its brief , according to a resolution unanimously agreed at the UN Security Council on March , was to look at the requirements for a future peacekeeping operation and to create "" mechanisms to ensure humanitarian aid can get through unhindered "" .",get through
"['get', 'together']",K/K4/K44.xml,22,true,0.6773,"['This', 'all', 'started', 'in', 'when', 'a', 'handful', 'of', 'residents', 'got', 'together', 'and', 'decided', 'to', 'take', 'action', 'to', 'get', 'better', 'homes', '.']","[9, 10]","['got', 'together']",This all started in when a handful of residents got together and decided to take action to get better homes .,got together
"['get', 'at']",K/KP/KP3.xml,668,true,1.0,"['Okay', 'well', 'that', ""'s"", 'what', 'she', ""'ll"", 'try', 'and', 'get', 'at', 'you', '.']","[9, 10]","['get', 'at']",Okay well that 's what she 'll try and get at you .,get at
"['get', 'together']",K/KA/KA6.xml,93,true,1.0,"['Do', 'get', 'together', 'and', 'discuss', 'the', 'problem', 'and', 'send', 'in', 'any', 'ideas', 'you', 'may', 'have', 'to', 'the', 'office', '.']","[1, 2]","['get', 'together']",Do get together and discuss the problem and send in any ideas you may have to the office .,get together
"['get', 'out']",H/HT/HTH.xml,1779,true,1.0,"['Perhaps', 'they', 'got', 'out', '.']","[2, 3]","['got', 'out']",Perhaps they got out .,got out
"['make', 'over']",C/CF/CFW.xml,1349,false,1.0,"['The', 'Group', ""'s"", 'responsibility', 'for', 'site-specific', 'geophysical', 'surveys', 'brings', 'with', 'it', 'the', 'parallel', 'responsibility', 'for', 'databasing', 'the', 'considerable', 'archive', 'of', 'material', 'from', 'surveys', 'of', 'this', 'kind', 'made', 'over', 'the', 'years', 'since', 'the', 'Geophysics', 'Department', 'was', 'set', 'up', 'in', 'the', 'former', 'Geological', 'Survey', 'of', 'Great', 'Britain', '.']","[26, 27]","['made', 'over']",The Group 's responsibility for site-specific geophysical surveys brings with it the parallel responsibility for databasing the considerable archive of material from surveys of this kind made over the years since the Geophysics Department was set up in the former Geological Survey of Great Britain .,made over
"['take', 'on']",F/FN/FNX.xml,1645,true,1.0,"['To', 'help', 'publicise', 'the', 'launch', 'of', 'the', 'airline', ',', 'Branson', 'had', 'taken', 'on', 'the', 'services', 'of', 'Tony', 'Brainsby', ',', 'a', 'man', 'whose', 'hyperventilated', 'style', 'of', 'press-arousal', 'on', 'behalf', 'of', 'such', 'clients', 'as', 'Paul', 'McCartney', 'had', 'made', 'him', 'a', 'small', 'legend', 'in', 'the', 'pop', 'world', '.']","[11, 12]","['taken', 'on']","To help publicise the launch of the airline , Branson had taken on the services of Tony Brainsby , a man whose hyperventilated style of press-arousal on behalf of such clients as Paul McCartney had made him a small legend in the pop world .",taken on
"['give', 'in']",A/AD/AD1.xml,2515,true,1.0,"['You', 'are', 'old', ',', 'you', 'are', 'bed-ridden', ',', 'the', 'work', 'falls', 'to', 'me', ',', 'you', 'do', 'not', 'think', 'or', 'care', ',', 'lying', 'here', 'day', 'after', 'day', ',', 'waited', 'upon', 'and', 'given', 'in', 'to', ',', 'without', 'worries', 'or', 'anxiety', '.']","[30, 31]","['given', 'in']","You are old , you are bed-ridden , the work falls to me , you do not think or care , lying here day after day , waited upon and given in to , without worries or anxiety .",given in
"['have', 'on']",H/HW/HWF.xml,1118,false,0.6693,"['If', 'you', 'decide', 'to', 'accept', 'the', 'modification', ',', 'then', 'you', 'should', 'consider', 'what', 'effect', ',', 'if', 'any', ',', 'it', 'has', 'on', 'your', 'package', 'and', 'raise', 'a', 'DC', 'of', 'your', 'own', '.']","[19, 20]","['has', 'on']","If you decide to accept the modification , then you should consider what effect , if any , it has on your package and raise a DC of your own .",has on
"['get', 'on']",A/A6/A6N.xml,509,true,0.6905,"['They', 'all', 'got', 'on', 'our', 'backs', '.']","[2, 3]","['got', 'on']",They all got on our backs .,got on
"['give', 'in']",C/CR/CRM.xml,7618,false,1.0,"['The', 'best-fit', 'values', 'for', 'parameters', 'are', 'given', 'in', 'Table', ';', 'the', 'uncertainties', 'are', 'confidence', ',', 'if', 'all', 'the', 'other', 'parameters', 'are', 'allowed', 'to', 'vary', '.']","[6, 7]","['given', 'in']","The best-fit values for parameters are given in Table ; the uncertainties are confidence , if all the other parameters are allowed to vary .",given in
"['get', 'about']",E/EV/EVJ.xml,470,true,1.0,"['To', 'speak', 'of', 'twelve', 'years', 'as', 'a', 'maximum', 'then', ',', 'or', 'to', 'talk', 'airily', 'of', '""', 'girls', 'marrying', 'when', 'they', 'get', 'about', '""', 'as', 'the', 'employers', 'quoted', 'earlier', 'did', ',', 'is', 'misleading', '.']","[20, 21]","['get', 'about']","To speak of twelve years as a maximum then , or to talk airily of "" girls marrying when they get about "" as the employers quoted earlier did , is misleading .",get about
"['get', 'on', 'with']",H/HT/HTW.xml,2017,true,1.0,"[""Let's"", 'get', 'on', 'with', 'the', 'clothes', '.']","[1, 2, 3]","['get', 'on', 'with']",Let's get on with the clothes .,get on with
"['make', 'out']",C/CS/CS0.xml,186,true,1.0,"['While', 'one', 'may', 'sometimes', 'wonder', 'whether', 'some', 'of', 'one', ""'s"", 'colleagues', 'were', 'quite', 'as', 'warmly', 'welcomed', 'as', 'they', 'make', 'out', ',', 'most', 'returned', 'field-workers', 'readily', 'assume', 'the', 'role', 'of', 'genial', 'impresarios', 'or', 'spokesmen', 'for', 'their', 'exotic', 'hosts', '.']","[18, 19]","['make', 'out']","While one may sometimes wonder whether some of one 's colleagues were quite as warmly welcomed as they make out , most returned field-workers readily assume the role of genial impresarios or spokesmen for their exotic hosts .",make out
