pvc_lemmas,file_path,row,is_phrasal,annotator_agreement_percentage,sents,aligned_idxs,verbs_fixed,sent_string,verb_string
"['get', 'out']",A/AN/ANR.xml,633,false,0.6526,"['as', 'soon', 'as', 'the', 'Empress', 'saw', 'a', 'place', 'which', 'was', 'totally', 'wild', 'with', 'virtually', 'unclimbable', 'rocks', 'everyone', 'got', 'out', 'of', 'the', 'carriage', 'and', 'she', 'set', 'out', ',', 'armed', 'with', 'a', 'stout', 'walking', 'stick', ',', 'to', 'beat', 'a', 'path', 'over', 'huge', 'rocks', ',', 'clumps', 'of', 'juniper', 'bushes', ',', 'enormous', 'ferns', 'as', 'high', 'as', 'shrubs', '.']","[17, 18]","['got', 'out']","as soon as the Empress saw a place which was totally wild with virtually unclimbable rocks everyone got out of the carriage and she set out , armed with a stout walking stick , to beat a path over huge rocks , clumps of juniper bushes , enormous ferns as high as shrubs .",got out
"['get', 'onto']",K/KD/KDV.xml,4561,true,1.0,"['No', ',', 'you', 'get', 'onto', 'dad', '.']","[3, 4]","['get', 'onto']","No , you get onto dad .",get onto
"['get', 'out']",K/KC/KCW.xml,1060,true,0.6697,"['I', 'asked', 'in', 'front', 'of', 'the', 'whole', 'class', ',', 'and', 'you', 'get', 'out', 'Lorna', '.']","[11, 12]","['get', 'out']","I asked in front of the whole class , and you get out Lorna .",get out
"['get', 'out']",G/G0/G0E.xml,769,false,0.6629,"['Yes', ',', 'it', 'started', 'again', 'while', 'I', 'was', 'running', 'to', 'get', 'out', 'of', 'that', 'place', '.']","[10, 11]","['get', 'out']","Yes , it started again while I was running to get out of that place .",get out
"['have', 'on']",G/G1/G1X.xml,639,true,0.6534,"['At', 'bottom', ',', 'this', 'is', 'the', 'grip', 'which', 'the', 'story', 'of', 'Jonah', 'and', 'the', 'whale', 'still', 'has', 'on', 'us', ':', 'fear', 'of', 'being', 'devoured', 'by', 'a', 'large', 'creature', ',', 'fear', 'of', 'being', 'chomped', ',', 'slurped', ',', 'gargled', ',', 'washed', 'down', 'with', 'a', 'draught', 'of', 'salt', 'water', 'and', 'a', 'school', 'of', 'anchovies', 'as', 'a', 'chaser', ';', 'fear', 'of', 'being', 'blinded', ',', 'darkened', ',', 'suffocated', ',', 'drowned', ',', 'hooded', 'with', 'blubber', ';', 'fear', 'of', 'sensory', 'deprivation', 'which', 'we', 'know', 'drives', 'people', 'mad', ';', 'fear', 'of', 'being', 'dead', '.']","[16, 17]","['has', 'on']","At bottom , this is the grip which the story of Jonah and the whale still has on us : fear of being devoured by a large creature , fear of being chomped , slurped , gargled , washed down with a draught of salt water and a school of anchovies as a chaser ; fear of being blinded , darkened , suffocated , drowned , hooded with blubber ; fear of sensory deprivation which we know drives people mad ; fear of being dead .",has on
"['make', 'for']",J/J5/J57.xml,1705,true,0.6546,"['Adversary', 'politics', 'and', 'changes', 'in', 'government', 'may', 'make', 'for', '""', 'exciting', 'politics', ',', '""', 'but', 'they', 'produce', '""', 'low-credibility', 'Government', 'strategies', ',', 'whichever', 'party', 'is', 'in', 'power', '.', '""']","[7, 8]","['make', 'for']","Adversary politics and changes in government may make for "" exciting politics , "" but they produce "" low-credibility Government strategies , whichever party is in power . """,make for
"['make', 'out']",B/B0/B0U.xml,1799,false,1.0,"['But', 'soon', 'they', 'too', 'would', 'be', 'absorbed', 'by', 'the', 'world', 'of', 'the', 'camp', ',', 'know', 'their', 'way', 'about', 'it', 'in', 'their', 'sleep', ',', 'do', 'the', 'washing-up', 'and', 'water-carrying', 'once', 'a', 'week', ',', 'or', 'walk', 'about', 'like', 'negroes', 'in', 'G-strings', 'made', 'out', 'of', 'a', 'towel', '.']","[39, 40]","['made', 'out']","But soon they too would be absorbed by the world of the camp , know their way about it in their sleep , do the washing-up and water-carrying once a week , or walk about like negroes in G-strings made out of a towel .",made out
"['get', 'out']",K/KD/KD0.xml,1318,false,1.0,"['James', 'right', 'like', 'Mr', 'right', 'he', 'did', ""n't"", 'know', 'right', 'and', 'we', 'have', 'this', 'sort', 'of', 'erm', 'water', 'fountain', 'and', 'he', 'was', 'running', 'towards', 'it', 'and', 'he', ',', 'and', 'he', 'filled', 'up', 'his', 'mouth', 'with', 'it', 'and', 'he', 'was', 'spitting', 'it', 'everywhere', 'and', 'we', 'were', 'all', 'sort', 'of', 'getting', 'out', 'the', 'way', 'and', 'Mr', 'told', 'him', 'if', 'you', 'do', ""n't"", 'want', 'to', 'drink', 'it', 'then', 'leave', 'it', 'alone', 'and', 'he', 'sort', 'of', 'turned', 'and', 'walked', 'away', '.']","[48, 49]","['getting', 'out']","James right like Mr right he did n't know right and we have this sort of erm water fountain and he was running towards it and he , and he filled up his mouth with it and he was spitting it everywhere and we were all sort of getting out the way and Mr told him if you do n't want to drink it then leave it alone and he sort of turned and walked away .",getting out
"['get', 'out']",E/ED/EDJ.xml,1628,true,1.0,"['Sorry', ',', 'I', ""'ve"", 'clunked', 'the', 'doors', ',', 'you', 'ca', ""n't"", 'get', 'out', ',', 'we', ""'re"", 'all', 'in', 'this', 'together', '.']","[11, 12]","['get', 'out']","Sorry , I 've clunked the doors , you ca n't get out , we 're all in this together .",get out
"['get', 'out']",K/KB/KBW.xml,1471,true,1.0,"['So', 'this', 'car', 'that', 'was', 'trying', 'to', 'get', 'out', 'was', 'sitting', 'there', 'waiting', 'and', 'there', 'was', 'no', 'driver', 'in', 'sight', 'and', 'people', 'were', 'rushing', 'about', 'all', 'over', 'the', 'station', 'trying', 'to', 'find', 'the', 'driver', '.']","[7, 8]","['get', 'out']",So this car that was trying to get out was sitting there waiting and there was no driver in sight and people were rushing about all over the station trying to find the driver .,get out
"['get', 'out']",H/H9/H9N.xml,485,true,0.6767,"['I', 'wondered', 'if', 'blood', 'was', 'hard', 'to', 'get', 'out', '.']","[7, 8]","['get', 'out']",I wondered if blood was hard to get out .,get out
"['get', 'out']",F/FY/FYV.xml,530,false,0.6696,"['One', 'night', 'I', 'got', 'out', 'of', 'bed', 'and', 'drove', 'very', 'badly', 'to', 'an', 'office', '.']","[3, 4]","['got', 'out']",One night I got out of bed and drove very badly to an office .,got out
"['get', 'on']",G/GU/GU7.xml,128,true,1.0,"['He', 'was', 'also', 'a', 'man', 'who', 'got', 'on', 'well', 'with', 'almost', 'all', 'his', 'associates', ',', 'and', 'his', 'early', 'death', 'in', 'was', 'seen', 'as', 'a', 'great', 'blow', 'to', 'natural', 'history', '.']","[6, 7]","['got', 'on']","He was also a man who got on well with almost all his associates , and his early death in was seen as a great blow to natural history .",got on
"['get', 'down', 'to']",H/HG/HGD.xml,1333,true,1.0,"['Now', 'if', 'we', 'could', 'get', 'down', 'to', 'the', 'sale', 'of', 'this', 'house', 'and', 'the', 'contents', '?']","[4, 5, 6]","['get', 'down', 'to']",Now if we could get down to the sale of this house and the contents ?,get down to
"['take', 'on']",H/HH/HHX.xml,18272,true,0.6767,"['I', 'believe', 'that', 'it', 'will', 'be', 'updated', 'as', 'the', 'new', 'computer', 'takes', 'on', 'additional', 'information', ',', 'but', 'when', 'and', 'at', 'exactly', 'what', 'point', 'is', 'a', 'matter', 'on', 'which', 'I', 'shall', 'have', 'to', 'get', 'back', 'to', 'the', 'hon.', 'Gentleman', 'because', 'I', 'do', 'not', 'know', 'ACPO', ""'s"", 'plans', '.']","[11, 12]","['takes', 'on']","I believe that it will be updated as the new computer takes on additional information , but when and at exactly what point is a matter on which I shall have to get back to the hon. Gentleman because I do not know ACPO 's plans .",takes on
"['get', 'through']",K/KS/KSV.xml,567,true,1.0,"['I', 'must', 'of', 'tried', 'probably', 'fifteen', 'times', 'last', 'night', 'to', 'get', 'through', '.']","[10, 11]","['get', 'through']",I must of tried probably fifteen times last night to get through .,get through
"['get', 'through']",A/AD/ADK.xml,688,true,0.675,"['When', 'you', 'come', 'to', 'detailed', 'programme', 'planning', ',', 'you', 'need', 'variety', 'and', 'balance', 'and', ',', 'if', 'you', 'have', 'a', 'great', 'deal', 'to', 'get', 'through', 'and', 'a', 'concentrated', 'message', 'to', 'communicate', ',', 'you', 'still', 'have', 'to', 'break', 'it', 'up', 'and', 'give', 'people', 'a', 'chance', 'to', 'relax', 'their', 'brains', 'as', 'well', 'as', 'their', 'bodies', '.']","[22, 23]","['get', 'through']","When you come to detailed programme planning , you need variety and balance and , if you have a great deal to get through and a concentrated message to communicate , you still have to break it up and give people a chance to relax their brains as well as their bodies .",get through
"['get', 'out']",H/HW/HWC.xml,189,true,0.6502,"['All', 'I', ""'ve"", 'ever', 'got', 'out', 'of', 'it', 'are', 'a', 'few', 'funny', 'smells', 'and', 'the', 'tap-tap', 'of', 'my', 'father', ""'s"", 'stick', '.']","[4, 5]","['got', 'out']",All I 've ever got out of it are a few funny smells and the tap-tap of my father 's stick .,got out
"['give', 'in']",H/H8/H8D.xml,1752,true,0.5963,"['No', 'more', 'detailed', 'official', 'guidance', 'has', 'been', 'given', 'in', 'the', 'succeeding', 'years', '.']","[7, 8]","['given', 'in']",No more detailed official guidance has been given in the succeeding years .,given in
"['get', 'out']",C/CJ/CJA.xml,2809,false,1.0,"['You', 'have', 'to', 'pay', 'this', 'lot', 'to', 'get', 'out', 'of', 'the', 'way', '.']","[7, 8]","['get', 'out']",You have to pay this lot to get out of the way .,get out
"['get', 'at']",J/J3/J3P.xml,110,false,0.7222,"['Erm', ',', 'I', 'would', 'have', 'to', 'say', 'that', ""'s"", 'going', 'to', 'be', 'in', 'the', 'range', 'of', 'five', 'hundred', 'to', 'six', 'hundred', ',', 'and', 'very', 'much', 'depends', 'to', 'some', 'extent', 'on', 'what', 'happens', 'in', 'the', 'winter', 'months', ',', 'and', 'I', ""'m"", 'sorry', 'to', 'keep', 'stressing', 'this', 'point', ',', 'but', 'we', 'have', ""n't"", 'yet', 'got', 'twelve', 'months', ""'"", 'experience', 'of', 'operating', 'this', 'particular', 'change', ',', 'and', 'until', 'we', ""'ve"", 'got', 'at', 'least', 'a', 'year', ""'s"", 'experience', ',', 'and', 'I', 'think', 'one', 'would', 'have', 'to', 'say', ',', 'that', 'some', 'of', 'the', 'figures', 'need', 'to', 'be', 'portioned', ',', 'but', 'equally', ',', 'you', 'ca', ""n't"", 'afford', 'to', 'be', 'too', 'cavalier', 'in', 'terms', 'of', 'your', 'assumptions', 'about', 'that', 'demand', 'might', 'reduce', 'to', ',', 'and', 'I', ""'ll"", 'touch', 'a', 'little', 'later', 'on', 'how', 'you', 'control', 'expenditure', 'in', 'those', 'terms', '.']","[67, 68]","['got', 'at']","Erm , I would have to say that 's going to be in the range of five hundred to six hundred , and very much depends to some extent on what happens in the winter months , and I 'm sorry to keep stressing this point , but we have n't yet got twelve months ' experience of operating this particular change , and until we 've got at least a year 's experience , and I think one would have to say , that some of the figures need to be portioned , but equally , you ca n't afford to be too cavalier in terms of your assumptions about that demand might reduce to , and I 'll touch a little later on how you control expenditure in those terms .",got at
"['get', 'together']",H/HD/HD1.xml,1025,true,0.6763,"['After', 'an', 'informal', 'get', 'together', 'over', 'cheese', 'n', 'wine', 'the', 'business', 'meeting', 'was', 'held', '.']","[3, 4]","['get', 'together']",After an informal get together over cheese n wine the business meeting was held .,get together
"['get', 'out']",H/HT/HTX.xml,845,true,1.0,"['If', 'anything', 'gets', 'out', ',', 'said', 'Georgiades', ',', 'it', 'wo', ""n't"", 'be', 'linked', 'with', 'us', '.']","[2, 3]","['gets', 'out']","If anything gets out , said Georgiades , it wo n't be linked with us .",gets out
"['do', 'up']",G/GV/GVT.xml,1346,true,1.0,"['Then', 'there', 'are', 'some', 'pathetic', ',', 'weedy', 'looking', 'swots', ',', 'inadequately', 'equipped', 'and', 'unsuitably', 'dressed', ',', 'in', 'gaberdine', 'raincoats', 'and', 'Oxford', 'shoes', ',', 'unwieldy', 'packs', 'all', 'done', 'up', 'with', 'string', ',', 'who', 'look', 'as', 'if', 'they', 'have', 'never', 'walked', 'farther', 'than', 'a', 'hundred', 'yards', 'at', 'any', 'time', 'in', 'their', 'lives', '.']","[26, 27]","['done', 'up']","Then there are some pathetic , weedy looking swots , inadequately equipped and unsuitably dressed , in gaberdine raincoats and Oxford shoes , unwieldy packs all done up with string , who look as if they have never walked farther than a hundred yards at any time in their lives .",done up
"['do', 'up']",K/KC/KCP.xml,2942,true,1.0,"['Yeah', 'I', 'ai', ""n't"", ',', 'I', 'ai', ""n't"", 'done', 'any', 'work', 'here', 'rea', 'really', 'since', ',', 'you', 'know', 'done', 'up', 'the', 'place', '.']","[18, 19]","['done', 'up']","Yeah I ai n't , I ai n't done any work here rea really since , you know done up the place .",done up
"['get', 'out']",C/CJ/CJF.xml,1851,true,0.681,"['Suddenly', 'she', 'wanted', 'him', 'gone', 'so', 'urgently', 'that', 'it', 'was', 'all', 'she', 'could', 'do', 'not', 'to', 'order', 'him', 'to', 'get', 'out', '.']","[19, 20]","['get', 'out']",Suddenly she wanted him gone so urgently that it was all she could do not to order him to get out .,get out
"['get', 'off']",C/CB/CBC.xml,11498,true,1.0,"['Generally', 'men', 'sentenced', 'for', 'rape', 'get', 'off', 'very', 'lightly', '.']","[5, 6]","['get', 'off']",Generally men sentenced for rape get off very lightly .,get off
"['get', 'behind']",C/CD/CDM.xml,2210,true,1.0,"['I', 'told', 'yer', 'ter', 'open', 'the', 'door', 'wide', ',', 'not', 'ter', 'get', 'behind', 'it', ',', 'he', 'chuckled', '.']","[11, 12]","['get', 'behind']","I told yer ter open the door wide , not ter get behind it , he chuckled .",get behind
"['give', 'in']",C/CS/CS7.xml,53,false,0.7014,"['An', 'example', 'is', 'given', 'in', 'the', 'review', 'of', 'the', 'Italian', 'reform', 'edited', 'by', 'Perris', 'and', 'Kemali', '.']","[3, 4]","['given', 'in']",An example is given in the review of the Italian reform edited by Perris and Kemali .,given in
"['get', 'on']",C/CB/CBW.xml,1501,true,1.0,"['If', 'the', 'management', 'and', 'the', 'institutions', 'do', ""n't"", 'feel', 'they', 'are', 'going', 'to', 'get', 'on', ',', 'there', 'is', 'little', 'point', 'in', 'continuing', '.']","[13, 14]","['get', 'on']","If the management and the institutions do n't feel they are going to get on , there is little point in continuing .",get on
"['make', 'for']",A/AR/ARJ.xml,2671,true,1.0,"['Only', 'the', 'rich', 'can', 'ski', 'in', 'Switzerland', 'which', 'makes', 'for', 'a', 'degree', 'of', 'civilisation', 'neighbours', 'ca', ""n't"", 'match', '.']","[8, 9]","['makes', 'for']",Only the rich can ski in Switzerland which makes for a degree of civilisation neighbours ca n't match .,makes for
"['get', 'on']",F/FT/FTT.xml,1421,false,1.0,"['Then', 'we', 'got', 'on', 'board', 'the', 'little', '""', 'Fingal', '""', 'and', 'soon', 'were', 'joined', 'by', 'a', 'number', 'who', 'had', 'travelled', 'with', 'us', 'when', 'we', 'came', 'and', 'whom', 'we', 'greeted', 'as', 'old', 'friends', '.']","[2, 3]","['got', 'on']","Then we got on board the little "" Fingal "" and soon were joined by a number who had travelled with us when we came and whom we greeted as old friends .",got on
"['get', 'at']",J/JT/JTD.xml,534,true,1.0,"['Can', 'you', 'understand', 'what', 'I', ""'m"", 'trying', 'to', 'get', 'at', '.']","[8, 9]","['get', 'at']",Can you understand what I 'm trying to get at .,get at
"['get', 'on', 'with']",G/G1/G1S.xml,2998,true,0.6364,"['But', 'Teddy', 'Hargreaves', 'will', 'do', 'to', 'be', 'getting', 'on', 'with', '.']","[7, 8, 9]","['getting', 'on', 'with']",But Teddy Hargreaves will do to be getting on with .,getting on with
"['get', 'by']",C/CG/CGB.xml,1067,true,1.0,"['You', 'can', 'get', 'by', ',', 'you', 'can', 'have', 'fun', '.']","[2, 3]","['get', 'by']","You can get by , you can have fun .",get by
"['make', 'out']",C/CG/CGD.xml,496,true,1.0,"['The', 'position', 'had', 'been', 'reached', 'where', 'she', 'could', 'not', 'make', 'out', 'the', 'labels', 'on', 'the', 'cans', 'of', 'food', 'she', 'was', 'heating', 'up', '.']","[9, 10]","['make', 'out']",The position had been reached where she could not make out the labels on the cans of food she was heating up .,make out
"['get', 'by']",B/B3/B38.xml,3206,true,0.9258,"['And', 'now', 'there', ""'s"", 'the', ""Ne'erday"", 'to', 'get', 'by', '.']","[7, 8]","['get', 'by']",And now there 's the Ne'erday to get by .,get by
"['get', 'together']",H/HH/HH7.xml,1071,true,0.6767,"['He', 'and', 'a', 'motor', 'trader', 'got', 'together', 'to', 'deceive', 'the', 'finance', 'company', '.']","[5, 6]","['got', 'together']",He and a motor trader got together to deceive the finance company .,got together
"['take', 'on']",C/CN/CN6.xml,1236,false,0.7222,"['Recently', ',', 'however', ',', 'two', 'small-scale', 'studies', 'have', 'been', 'completed', 'which', 'take', 'on', 'board', 'the', 'perceptions', 'and', 'experiences', 'of', 'parents', 'who', 'have', 'been', 'on', 'the', 'receiving', 'end', 'of', 'child', 'protection', 'interventions', '.']","[11, 12]","['take', 'on']","Recently , however , two small-scale studies have been completed which take on board the perceptions and experiences of parents who have been on the receiving end of child protection interventions .",take on
"['get', 'off']",A/AB/ABK.xml,2858,true,1.0,"['Research', 'by', 'David', 'Ellwood', ',', 'at', 'Harvard', 'University', ',', 'shows', 'that', 'the', 'surest', 'way', 'for', 'a', 'woman', 'to', 'escape', 'poverty', ',', 'and', 'get', 'off', 'welfare', ',', 'is', 'not', 'to', 'work', 'but', 'to', 'get', 'married', '.']","[22, 23]","['get', 'off']","Research by David Ellwood , at Harvard University , shows that the surest way for a woman to escape poverty , and get off welfare , is not to work but to get married .",get off
"['have', 'on']",K/KA/KAC.xml,74,false,1.0,"['The', 'Publicity', 'Committee', 'are', 'planning', 'to', 'have', 'on', 'sale', 'for', 'the', 'first', 'time', 'at', 'Crystal', 'Palace', 'a', 'range', 'of', 'metalled', 'key-rings', 'and', 'pendants', 'which', 'they', 'think', 'will', 'make', 'very', 'nice', 'Christmas', 'presents', '.']","[6, 7]","['have', 'on']",The Publicity Committee are planning to have on sale for the first time at Crystal Palace a range of metalled key-rings and pendants which they think will make very nice Christmas presents .,have on
"['get', 'over']",E/ED/EDJ.xml,295,true,1.0,"['But', 'for', 'some', 'reason', 'old', 'Stuart', 'ca', ""n't"", 'get', 'over', 'it', '.']","[8, 9]","['get', 'over']",But for some reason old Stuart ca n't get over it .,get over
"['get', 'at']",C/CJ/CJX.xml,449,true,1.0,"['He', 'was', 'last', 'year', 'about', 'now', 'but', 'Easter', ""'s"", 'late', ',', 'I', 'had', ""n't"", 'thought', 'on', ',', 'and', 'he', ""'ll"", 'not', 'move', 'down', 'until', 'Palm', 'Sunday', 'like', 'as', 'not', ',', 'and', 'if', 'he', ""'s"", 'still', 'over', 'on', 'the', 'mountain', 'he', ""'ll"", 'be', 'up', 'Three', 'Valleys', 'Pass', 'and', 'that', ""'s"", 'an', 'hour', 'and', 'a', 'half', 'of', 'a', 'walk', 'for', 'him', ',', 'going', 'as', 'the', 'crow', 'flies', ',', 'but', 'longer', 'for', 'us', 'in', 'the', 'jeep', 'because', 'there', ""'s"", 'no', 'direct', 'road', 'and', 'then', 'to', 'get', 'at', 'him', 'we', ""'d"", 'have', 'to', 'take', 'a', 'cart', 'track', 'that', ""'ll"", 'be', 'more', 'like', 'a', 'river', 'bed', 'after', 'yesterday', ""'s"", 'rain', '.']","[82, 83]","['get', 'at']","He was last year about now but Easter 's late , I had n't thought on , and he 'll not move down until Palm Sunday like as not , and if he 's still over on the mountain he 'll be up Three Valleys Pass and that 's an hour and a half of a walk for him , going as the crow flies , but longer for us in the jeep because there 's no direct road and then to get at him we 'd have to take a cart track that 'll be more like a river bed after yesterday 's rain .",get at
"['take', 'on']",C/C8/C87.xml,142,true,1.0,"['Armed', 'with', 'their', 'newest', 'inventions', 'a', 'super-duper', 'jeep', 'and', 'hi-tech', 'helicopter', 'they', 'vow', 'to', 'take', 'on', 'the', 'forces', 'of', 'evil', 'and', 'blast', 'their', 'way', 'to', 'freedom', 'so', 'get', 'blasting', '!']","[14, 15]","['take', 'on']",Armed with their newest inventions a super-duper jeep and hi-tech helicopter they vow to take on the forces of evil and blast their way to freedom so get blasting !,take on
"['get', 'through']",G/GU/GUK.xml,251,true,1.0,"['She', 'got', 'through', 'it', 'without', 'a', 'mistake', '.']","[1, 2]","['got', 'through']",She got through it without a mistake .,got through
"['make', 'for']",H/H0/H0R.xml,1391,true,1.0,"['Something', 'made', 'for', 'him', 'in', 'the', 'darkness', 'and', 'struck', 'him', 'a', 'violent', 'blow', 'just', 'under', 'the', 'knee', '.']","[1, 2]","['made', 'for']",Something made for him in the darkness and struck him a violent blow just under the knee .,made for
"['get', 'out']",A/AB/ABX.xml,1951,false,0.6666,"['He', 'wanted', 'to', 'get', 'out', 'of', 'the', 'shed', '.']","[3, 4]","['get', 'out']",He wanted to get out of the shed .,get out
"['make', 'for']",C/CD/CDS.xml,312,false,1.0,"['He', 'said', 'that', 'all', 'Waddell', ""'s"", 'confessions', 'had', 'been', 'made', 'for', 'drink', 'or', 'money', 'but', 'did', ""n't"", 'add', 'that', 'the', 'clandestine', 'confession', 'given', 'to', 'the', 'two', 'BBC', 'reporters', 'had', 'been', 'made', 'for', 'neither', '.']","[30, 31]","['made', 'for']",He said that all Waddell 's confessions had been made for drink or money but did n't add that the clandestine confession given to the two BBC reporters had been made for neither .,made for
"['take', 'on']",C/C9/C95.xml,3053,true,0.6781,"['Both', 'brushes', 'and', 'foam', 'can', 'also', 'take', 'on', 'a', 'partial', 'biofiltering', 'role', ',', 'but', 'if', 'they', 'are', 'intended', 'to', 'be', 'a', 'mechanical', 'filter', ',', 'they', 'should', 'be', 'cleaned', 'before', 'they', 'clog', '.']","[6, 7]","['take', 'on']","Both brushes and foam can also take on a partial biofiltering role , but if they are intended to be a mechanical filter , they should be cleaned before they clog .",take on
"['get', 'together']",H/H4/H4B.xml,290,true,1.0,"['It', 'was', ""n't"", 'till', ',', 'till', 'people', 'got', 'together', 'into', 'factories', 'and', ',', 'and', 'er', 'workshops', 'and', ',', 'and', 'things', 'like', 'that', '.']","[7, 8]","['got', 'together']","It was n't till , till people got together into factories and , and er workshops and , and things like that .",got together
"['take', 'on']",F/F9/F9F.xml,1128,true,1.0,"['One', 'species', 'of', 'beetle', 'in', 'Brazil', ',', 'when', 'alarmed', ',', 'immediately', 'folds', 'up', 'its', 'legs', 'and', 'flattens', 'itself', 'sideways', ',', 'exposing', 'its', 'white', 'underside', 'and', 'so', 'takes', 'on', 'the', 'appearance', 'of', 'a', 'bird', 'dropping', '.']","[26, 27]","['takes', 'on']","One species of beetle in Brazil , when alarmed , immediately folds up its legs and flattens itself sideways , exposing its white underside and so takes on the appearance of a bird dropping .",takes on
"['take', 'on']",H/HH/HH3.xml,8602,true,1.0,"['But', 'these', 'objects', ',', 'ritualistically', 'sprinkled', 'and', 'gestured', 'over', 'by', 'a', 'Catholic', 'priest', 'or', 'Aymara', 'sage', ',', 'take', 'on', 'a', 'new', 'significance', 'as', 'promises', 'of', 'future', 'prosperity', '.']","[17, 18]","['take', 'on']","But these objects , ritualistically sprinkled and gestured over by a Catholic priest or Aymara sage , take on a new significance as promises of future prosperity .",take on
"['take', 'after']",H/HN/HNV.xml,455,false,1.0,"['Decision', 'B', 'can', 'only', 'be', 'taken', 'after', 'the', 'result', 'of', 'action', 'consequent', 'upon', 'decision', 'A', 'is', 'known', '.']","[5, 6]","['taken', 'after']",Decision B can only be taken after the result of action consequent upon decision A is known .,taken after
"['get', 'on']",J/JY/JYN.xml,1398,true,0.6773,"['Anyway', 'I', 'must', 'get', 'on', '.']","[3, 4]","['get', 'on']",Anyway I must get on .,get on
"['take', 'on']",C/C9/C98.xml,1239,true,1.0,"['The', 'dale', 'took', 'on', 'a', 'crystalline', 'magic', ';', 'the', 'sun', 'climbed', 'above', 'the', 'skyline', 'of', 'the', 'moors', ',', 'touching', 'the', 'snow-covered', 'landscape', 'with', 'sparkling', 'highlights', '.']","[2, 3]","['took', 'on']","The dale took on a crystalline magic ; the sun climbed above the skyline of the moors , touching the snow-covered landscape with sparkling highlights .",took on
"['get', 'on']",K/KD/KDM.xml,197,true,0.6629,"['Rang', 'him', 'up', 'again', 'he', 'said', 'oh', 'aye', 'well', 'we', 'usually', 'change', 'those', 'he', 'said', ',', 'the', 'weather', 'gets', 'on', 'them', '.']","[18, 19]","['gets', 'on']","Rang him up again he said oh aye well we usually change those he said , the weather gets on them .",gets on
"['get', 'on']",K/KB/KBH.xml,2926,true,1.0,"['What', 'a', 'horror', 'they', 'drive', 'you', 'mad', 'though', ',', 'god', 'As', 'soon', 'as', 'you', ""'ve"", 'got', 'you', 'get', 'used', 'to', 'stage', 'with', 'just', 'Charlotte', 'where', 'you', 'can', 'get', 'on', 'and', 'do', 'things', 'an']","[27, 28]","['get', 'on']","What a horror they drive you mad though , god As soon as you 've got you get used to stage with just Charlotte where you can get on and do things an",get on
